index,published,topic,term,domain,language,valid,de,title,description,en,la,url,image,archive,content,quote,added,feed,country,ipcc,continent
7d0b021f6470b460f36cd23af23433fb,2025-11-15T15:23:00Z,Flood,inondations en France,www.ledauphine.com,fr,0.8,"Wetterbericht. Drôme und Ardèche haben am Sonntag den orangefarbenen Regen-Überschwemmungs-Alarm ausgelöst. Am Sonntag werden in der Drôme und der Ardèche starke Regenansammlungen in kurzer Zeit erwartet, warnt Météo France.",Météo. La Drôme et l'Ardèche placés en vigilance orange pluie-inondations dimanche,"De forts cumuls de pluie en peu de temps sont attendus dimanche sur la Drôme et l'Ardèche, prévient Météo France.","Weather report. Drôme and Ardèche placed on orange rain-flood alert on Sunday. Heavy accumulations of rain in a short time are expected on Sunday in the Drôme and Ardèche, warns Météo France.","Tempestas fama. Drome et Ardèche aurantiaca diluvium pluviae die Dominico vigilabant. Graves pluviae brevi tempore expectatae sunt die Dominico in Drome et Ardèche, monet Météo Gallia.",https://www.ledauphine.com/environnement/2025/11/15/la-drome-et-l-ardeche-places-en-vigilance-orange-pluie-inondations-dimanche,https://cdn-s-www.ledauphine.com/images/848EE9B1-070E-4966-8B5A-1CEA4513C27E/FB1200/photo-1763155517.jpg,,"La Drôme et l'Ardèche ont été placés samedi en vigilance orange pluie-inondations pour la journée de dimanche, a annoncé Météo France dans son bulletin de 16h. L'Ardèche avait déjà été placée vendred… [+1048 chars]",,2025-12-13 20:54:27+00:00,wmo,France,WCE,Europe
b5ab5bb9f80360ae22e5c87553150a78,2025-11-24T06:22:26Z,Flood,inondations en France,www.huffingtonpost.fr,fr,0.8,"Wetter: Orange-Alarm aufgrund einer „anhaltenden Regenepisode“ ausgelöst. Météo France hat an diesem Montag drei Departements auf Hochwasserwarnung wegen orangefarbenem Regen gesetzt, wobei mit erheblichen Ansammlungen zu rechnen ist.",Météo : La vigilance orange déclenchée à cause d’un « épisode pluvieux persistant »,"Météo France a placé trois départements en vigilance orange pluie inondations, ce lundi, alors que d’importants cumuls sont attendus.","Weather: Orange alert triggered due to a “persistent rainy episode”. Météo France has placed three departments on orange rain flood vigilance this Monday, while significant accumulations are expected.","Tempestas: Aureum erectum Urguet propter ""perstans res pluviae"". Météo Gallia tres rei in diluvio inundationis aurantiorum hanc Lunae vigilantiam posuit, dum significantes accumulationes expectantur.",https://www.huffingtonpost.fr/france/article/meteo-la-vigilance-orange-declenchee-a-cause-d-un-episode-pluvieux-persistant_257460.html,https://focus.huffingtonpost.fr/2024/03/06/228/0/4383/2465/1820/1023/75/0/9361476_1709731716784-000-9ql39j-1.jpg,,"Un lundi de pluie, qui oblige à la prudence. Météo-France a placé trois départements en vigilance orange pour risque de pluie-inondation, ce lundi 24 novembre, en raison dun « épisode pluvieux persis… [+1891 chars]",,2025-12-14 05:01:05+00:00,wmo,France,WCE,Europe
30321397382f6ae74f3e5084e1e4988a,2025-11-15T16:32:15Z,Flood,inondations en France,www.20minutes.fr,fr,0.8,Wetter: Drôme und Ardèche haben am Sonntagmorgen orangefarbene Regen- und Überschwemmungswarnung. Météo-France hat die Departements Drôme und Ardèche wegen Regen und Überschwemmungsgefahr für Sonntagmorgen in Alarmbereitschaft versetzt,Météo : La Drôme et l’Ardèche en vigilance orange pluie-inondation dimanche matin,Météo-France a placé les départements de la Drôme et de l’Ardèche en vigilance orange pour les pluies et les risques d’inondations pour dimanche matin,Weather: Drôme and Ardèche on orange rain-flood alert Sunday morning. Météo-France has placed the departments of Drôme and Ardèche on orange alert for rain and the risk of flooding for Sunday morning,Tempestas: Drome et Ardèche in diluvio pluviali aurantiaco mane die dominico erecti sunt. Météo-Gallia Dicasteria Drome et Ardèche in aurantiaco intenti ad pluviam et periculum inundationis in mane dominicae posuit,https://www.20minutes.fr/planete/4185848-20251115-meteo-drome-ardeche-vigilance-orange-pluie-inondation-dimanche-matin,https://img.20mn.fr/PR_wycXBQeqhJKWNl22j5yk/1444x920_lundi-27-janvier-2025-guipry-messac-ille-et-vilaine-tempete-herminia-inondation-guipry-messac-affronte-une-crue-historique-la-ille-et-vilaine-en-vigilance-rouge-pour-risque-de-crues-plusieurs-routes-sont-fermees-et-des-habitants-sont-evacues-guipry-messac-is-facing-a-historic-flood-ille-et-vilaine-on-red-alert-for-risk-of-flooding-several-roads-are-closed-and-residents-are-evacuated-neighbors-help-each-other-solidarity-is-organized-picaudjustin-beta01739-credit-justin-picaud-sipa-2501280756,,"Les départements de la Drôme et de lArdèche seront en vigilance orange pour les pluies et les risques dinondation dimanche matin, a annoncé samedi Météo-France.
Après une alerte orange samedi sur la… [+846 chars]",,2025-12-14 07:58:09+00:00,wmo,France,WCE,Europe
2d685dbf8ddb0c2903c1fee99b2937e0,2025-11-19T05:15:00Z,Snow&Ice,givre,www.leprogres.fr,fr,0.9,"Autotraining. Heißes Wasser: die (sehr) schlechte Idee zum Enteisen der Windschutzscheibe. Viele Autofahrer lassen sich von Eis einschließen. Und um schnell zu handeln, können wir manchmal eine Lösung wählen ... die sich als riskant und teuer erweisen kann",Pratique auto. Eau chaude : la (très) mauvaise idée pour dégivrer votre pare-brise,"De nombreux automobilistes se laissent piéger par le givre. Et parfois pour aller vite, on peut choisir une solution... qui peut s'avérer risquée et couteuse","Auto practice. Hot water: the (very) bad idea for defrosting your windshield. Many motorists allow themselves to be trapped by ice. And sometimes to move quickly, we can choose a solution... which can turn out to be risky and expensive","Consuetudo sui ipsius. Aqua calida: the (very) bad idea for defrosting your windshield. Multi motorists se pati glacie capi. Et interdum celeriter moveri, solutionem eligere possumus",https://www.leprogres.fr/magazine-automobile/2025/11/19/eau-chaude-la-(tres)-mauvaise-idee-pour-degivrer-votre-pare-brise,https://cdn-s-www.ledauphine.com/images/0B94CC21-F6E4-4DBA-9B49-E407736236EF/FB1200/photo-1763460358.jpg,,"Ce matin, il est l'heure de partir à l'école ou au travail et la voiture est gelée. Et forcément vous êtes en retard.
Il peut être tentant de démarrer et dégivrer en roulant quand le moteur sera cha… [+865 chars]",,2025-12-19 17:00:12+00:00,wmo,Canada,NEN,North-America
4341548bee7fba7bd0f65565fe1eec56,2025-11-20T16:01:00Z,Snow&Ice,givre,www.leprogres.fr,fr,0.9,"Autorechte. Verschmutzte oder gefrorene Windschutzscheibe: Können Gendarmen und Polizei ein Bußgeld verhängen? Im Winter, bei Schlamm, Schnee oder Frost, kommt es häufig vor, dass die Windschutzscheibe schmutzig oder vereist ist. Es ist nicht nur eine Frage des Aussehens, es ist gefährlich. Aber was riskieren Sie, abgesehen von den damit verbundenen Risiken, im Falle von ...",Droit auto. Pare-brise sale ou gelé : gendarmes et policiers peuvent-ils vous verbaliser ?,"En hiver, avec la boue, la neige ou le gel, il est fréquent de se retrouver avec un pare-brise sale ou recouvert de givre. Ce n’est pas seulement une question d’apparence, cela est dangereux. Mais en dehors des risques encourus, que risquez-vous en cas de con…","Auto rights. Dirty or frozen windshield: can the gendarmes and police fine you? In winter, with mud, snow or frost, it is common to find yourself with a dirty or frost-covered windshield. It’s not just a matter of appearance, it’s dangerous. But apart from the risks involved, what do you risk in the event of…","Iura Auto. Sordida vel gelida windshield, valene gendarmes et magistratus mulcendo te? Hieme, luto, nivibus, pruinis, commune est te ipsum invenire cum ventoso vel luto vel gelu cooperto. Non solum de specie, periculosum est. Sed sine periculo, quid in eventu periclitamini...",https://www.leprogres.fr/magazine-automobile/2025/11/20/pare-brise-sale-ou-gele-gendarmes-et-policiers-peuvent-ils-vous-verbaliser,https://cdn-s-www.ledauphine.com/images/8F9B0420-7D81-4658-8D57-FBD368453F6A/FB1200/photo-1674813344.jpg,,"« Pour circuler en toute sécurité, un automobiliste doit être en mesure d’avoir une bonne visibilité. On estime qu’au volant, 90% des informations passent par la vue ». La loi prévoit en effet des sa… [+745 chars]",,2025-12-19 17:00:12+00:00,wmo,Canada,NEN,North-America
9cc6f28f89ac0e43490db1e687d51c38,2025-11-26T06:16:17Z,Fog,brouillard belgique,www.lavenir.net,fr,0.9,"Wetter in Belgien an diesem Mittwoch: trockenes Wetter mit Lichtungen, aber achten Sie heute Morgen auf Nebel und Frost. Zwischen Nebel, Eis, trockenem Wetter und viel Sonnenschein ziehen wir eine Bilanz der IRM-Wettervorhersagen für diesen Mittwoch, den 26. November 2025 in Belgien. ...",Météo en Belgique ce mercredi: un temps sec avec des éclaircies mais attention au brouillard et au givre ce matin,"Entre le brouillard, du verglas, un temps sec et un large soleil, on fait le point sur les prévisions météo de l'IRM pour ce mercredi 26 novembre 2025 en Belgique. ...","Weather in Belgium this Wednesday: dry weather with clearings but watch out for fog and frost this morning. Between fog, ice, dry weather and plenty of sunshine, we take stock of the IRM weather forecasts for this Wednesday, November 26, 2025 in Belgium. ...","Tempestas in Belgio hoc Mercurii est: siccitatem cum purgationibus exercent, sed hanc mane nebulam et pruinam vigilate. Inter nebulam, glaciem, siccitatem et soles abundantiam, stirps tempestatum IRM praecognoscenda huius diei Mercurii, die 26 mensis Novembris anno 2025 in Belgio accipimus. ...",https://www.lavenir.net/actu/societe/meteo/2025/11/26/meteo-en-belgique-ce-mercredi-un-temps-sec-avec-des-eclaircies-mais-attention-au-brouillard-et-au-givre-ce-matin-HALKBDBEMVEIJJZYMAPB27BELM/,https://www.lavenir.net/resizer/v2/WPCYP4KGHNACRCASAGB3DCVH7Y.JPG?auth=f57a4577b5e8b252801270e51c0cf3f535063b2464a68e1a12277b64ddf3f5e6&width=1200&height=630&quality=85&focal=4128%2C2752,,"+ La météo dans votre régionDes bancs de nuages bas, accompagnés de brouillard possiblement givrant, se répandront mercredi matin dans le pays, a annoncé l'Institut royal météorologique (IRM) dans so… [+486 chars]",,2025-12-19 17:00:12+00:00,wmo,Belgium,WCE,Europe
e1e7c9afe0fd340900c30c2306e37445,2025-11-28T15:03:28Z,Snow&Ice,givre,www.tuxboard.com,fr,0.1,"Enteisungsspray: weniger als 4 € bei Amazon, taut Ihre Windschutzscheibe diesen Winter in Sekundenschnelle auf. Das Thermometer brennt und die Windschutzscheiben vereisen im Morgengrauen. Mit einem Enteisungsspray geht es schneller und sicherer los....
Der Artikel Enteisungsspray: weniger als 4 € bei Amazon, taut Ihre Windschutzscheibe diesen Winter in Sekundenschnelle erschien zuerst auf…","Spray dégivrant: moins de 4 € sur Amazon, dégivre votre pare-brise en quelques secondes cet hiver","Le thermomètre pique et les pare-brise givrent dès l’aube. Avec un spray dégivrant, vous partez plus vite et en sécurité....
L’article Spray dégivrant: moins de 4 € sur Amazon, dégivre votre pare-brise en quelques secondes cet hiver est apparu en premier sur …","Deicing spray: less than €4 on Amazon, defrosts your windshield in seconds this winter. The thermometer is stinging and the windshields are icing up at dawn. With a de-icing spray, you leave faster and safer....
The article Deicing spray: less than €4 on Amazon, defrosts your windshield in seconds this winter appeared first on…","Deiciendi imbre: minus quam €4 in Amazon, in secundis hac hieme efflores tuam windshield. Thermometrum aculeatum est et ventosi in vico sub aurora sunt. Cum de vico imbre, citius et tutius exeatis....
Articulum Deicing imbre: minus quam €4 in Amazon, defrosts tuum windshield in secundis hac hieme apparuit primum in ...",https://www.tuxboard.com/?p=1408393,https://www.tuxboard.com/wp-content/uploads/2025/11/1408393-image.jpg,,"À moins de 4 sur Amazon, le spray dégivrant dégivre votre pare-brise en quelques secondes pour un départ sûr et rapide par grand froid.

Le thermomètre pique et les pare-brise givrent dès laube. Avec… [+3864 chars]",,2025-12-19 17:00:12+00:00,wmo,Canada,NEN,North-America
